{
  "stage_id": "stage_1_extinction",
  "verdict": "approve",
  "accuracy_check": {
    "status": "pass",
    "paper_values_verified": true,
    "simulation_values_verified": true,
    "units_consistent": true,
    "axis_ranges_appropriate": true,
    "notes": "All values verified against paper digitized data"
  },
  "math_check": {
    "status": "pass",
    "discrepancy_calculations_correct": true,
    "percentage_calculations_correct": true,
    "classification_matches_thresholds": true,
    "errors_found": [],
    "notes": "All calculations verified manually"
  },
  "classification_check": {
    "status": "pass",
    "misclassifications": [],
    "notes": "Classification matches numerical discrepancy values"
  },
  "documentation_check": {
    "status": "pass",
    "all_discrepancies_logged": true,
    "sources_cited": true,
    "assumptions_documented": true,
    "missing_documentation": [],
    "notes": "All discrepancies properly documented with sources"
  },
  "issues": [],
  "revision_suggestions": [
    "Consider adding uncertainty bounds to paper values",
    "Include digitization error estimates in confidence calculation"
  ],
  "summary": "Comparison validation passed. All numerical comparisons are accurate, math calculations are correct, and classifications match the defined thresholds. Documentation is complete with all sources properly cited."
}



